{
  "acceptance": {
    "all_point_accuracy_targets_met": false,
    "candidate_within_range_error_limit": true,
    "consistent_candidate": false,
    "default_promotion_accepted": false,
    "default_promotion_reason": "A smooth-pipe correlation sweep without independent experiments or numerical uncertainty cannot establish a general industrial default.",
    "evidence_matrix_accepted": true,
    "maximum_range_relative_error": 0.05,
    "model_selection_required": true,
    "pairwise_identical_model_mesh": true,
    "range_candidate_accepted": false,
    "source_results_accepted": true,
    "wall_function_y_plus_range": true
  },
  "candidate_transitions": [
    {
      "from_turbulence_model": "k-omega-sst",
      "lower_reynolds_number": 99620.75848303393,
      "to_turbulence_model": "k-epsilon",
      "upper_reynolds_number": 199241.51696606787
    }
  ],
  "cross_section_cells": 16,
  "maximum_iterations": 4000,
  "mesh_strategy": {
    "adaptive_wall_cell_fraction": true,
    "pairwise_identical_model_mesh": true,
    "unique_mesh_count": 4
  },
  "model_statistics": [
    {
      "maximum_correlation_relative_error": 0.03589442884882674,
      "mean_correlation_relative_error": 0.023610136645645152,
      "mean_runtime_wall_seconds": 21.79125279125219,
      "nut_wall_function": "nutUSpaldingWallFunction",
      "point_wins": 2,
      "turbulence_model": "k-omega-sst"
    },
    {
      "maximum_correlation_relative_error": 0.03660939654533886,
      "mean_correlation_relative_error": 0.030765929212971593,
      "mean_runtime_wall_seconds": 20.11705820800489,
      "nut_wall_function": "nutkWallFunction",
      "point_wins": 2,
      "turbulence_model": "k-epsilon"
    }
  ],
  "points": [
    {
      "candidate_turbulence_model": "k-omega-sst",
      "cases": [
        {
          "colebrook_relative_error": 0.009531807115945997,
          "nut_wall_function": "nutUSpaldingWallFunction",
          "runtime_wall_seconds": 19.21701141599624,
          "source_accepted": true,
          "turbulence_model": "k-omega-sst",
          "wall_y_plus": {
            "average": 45.84540905,
            "maximum": 49.388172169,
            "minimum": 40.244446903
          }
        },
        {
          "colebrook_relative_error": 0.03660939654533886,
          "nut_wall_function": "nutkWallFunction",
          "runtime_wall_seconds": 18.03358304100402,
          "source_accepted": true,
          "turbulence_model": "k-epsilon",
          "wall_y_plus": {
            "average": 44.899576172,
            "maximum": 48.370648631,
            "minimum": 39.441347377
          }
        }
      ],
      "mesh_sha256": "1e38c1a4b5a548ba08a1e4ef3310c04dff766a6a9532def158c3f8bce2aba299",
      "nominal_wall_cell_fraction": 0.11886482721736276,
      "point_screening_accepted": true,
      "reynolds_number": 49810.37924151697,
      "source_results_accepted": true,
      "wall_function_y_plus_range": true
    },
    {
      "candidate_turbulence_model": "k-omega-sst",
      "cases": [
        {
          "colebrook_relative_error": 0.018514935175404576,
          "nut_wall_function": "nutUSpaldingWallFunction",
          "runtime_wall_seconds": 19.65623224900628,
          "source_accepted": true,
          "turbulence_model": "k-omega-sst",
          "wall_y_plus": {
            "average": 44.806032852,
            "maximum": 48.240615878,
            "minimum": 39.423297652
          }
        },
        {
          "colebrook_relative_error": 0.032894573695328944,
          "nut_wall_function": "nutkWallFunction",
          "runtime_wall_seconds": 17.02574291601195,
          "source_accepted": true,
          "turbulence_model": "k-epsilon",
          "wall_y_plus": {
            "average": 44.435571031,
            "maximum": 47.874756036,
            "minimum": 39.055881783
          }
        }
      ],
      "mesh_sha256": "4ef96b4249fe15497e399e14bcc7e904d2825f5cca3680ba78376e0aaf16065e",
      "nominal_wall_cell_fraction": 0.0625,
      "point_screening_accepted": true,
      "reynolds_number": 99620.75848303393,
      "source_results_accepted": true,
      "wall_function_y_plus_range": true
    },
    {
      "candidate_turbulence_model": "k-epsilon",
      "cases": [
        {
          "colebrook_relative_error": 0.0304993754424033,
          "nut_wall_function": "nutUSpaldingWallFunction",
          "runtime_wall_seconds": 23.281665792004787,
          "source_accepted": true,
          "turbulence_model": "k-omega-sst",
          "wall_y_plus": {
            "average": 57.162183406,
            "maximum": 61.552362135,
            "minimum": 50.296356138
          }
        },
        {
          "colebrook_relative_error": 0.029276995458867666,
          "nut_wall_function": "nutkWallFunction",
          "runtime_wall_seconds": 21.706199583000853,
          "source_accepted": true,
          "turbulence_model": "k-epsilon",
          "wall_y_plus": {
            "average": 57.324744648,
            "maximum": 61.761706571,
            "minimum": 50.393268795
          }
        }
      ],
      "mesh_sha256": "b8dab867572e767e29e140c6279f58e8c1283cbce48f11d2918135fb84fdf65a",
      "nominal_wall_cell_fraction": 0.04293684823025282,
      "point_screening_accepted": false,
      "reynolds_number": 199241.51696606787,
      "source_results_accepted": true,
      "wall_function_y_plus_range": true
    },
    {
      "candidate_turbulence_model": "k-epsilon",
      "cases": [
        {
          "colebrook_relative_error": 0.03589442884882674,
          "nut_wall_function": "nutUSpaldingWallFunction",
          "runtime_wall_seconds": 25.010101708001457,
          "source_accepted": true,
          "turbulence_model": "k-omega-sst",
          "wall_y_plus": {
            "average": 57.146707724,
            "maximum": 61.532024668,
            "minimum": 50.302930101
          }
        },
        {
          "colebrook_relative_error": 0.024282751152350904,
          "nut_wall_function": "nutkWallFunction",
          "runtime_wall_seconds": 23.702707292002742,
          "source_accepted": true,
          "turbulence_model": "k-epsilon",
          "wall_y_plus": {
            "average": 57.857776004,
            "maximum": 62.337524616,
            "minimum": 50.867271459
          }
        }
      ],
      "mesh_sha256": "a9b1b16bdca2213538ab3f1b3bd73f8d7e91c3b99d31390064c502fa57cb91c3",
      "nominal_wall_cell_fraction": 0.01872354578611706,
      "point_screening_accepted": false,
      "reynolds_number": 498103.79241516965,
      "source_results_accepted": true,
      "wall_function_y_plus_range": true
    }
  ],
  "recommendation": {
    "basis": "most point wins followed by minimum mean smooth-Colebrook difference",
    "candidate_nut_wall_function": "nutUSpaldingWallFunction",
    "candidate_turbulence_model": "k-omega-sst",
    "operational_use": "diagnostic-ranking-only",
    "sampled_range_only": true
  },
  "reynolds_range": {
    "maximum": 498103.79241516965,
    "minimum": 49810.37924151697,
    "point_count": 4
  },
  "schema": "agentcfd.turbulent-model-sweep/0.1",
  "sources": [
    {
      "path": "docs/openfoam-v2606-turbulent-model-study-re49810-y40.json",
      "sha256": "0e9cbde4a6d1e1c6ad299bdaf88d7f2454bc3f2df82e157364e0139410f461ec"
    },
    {
      "path": "docs/openfoam-v2606-turbulent-model-study.json",
      "sha256": "a0237e081d0e8f74c9c1cd5a191b525a5d86684643770bac3dcad213d768dcef"
    },
    {
      "path": "docs/openfoam-v2606-turbulent-model-study-re199242-y50.json",
      "sha256": "c7868c6496f76ef63197f65c388ea6954e05981b79a3343aae9e4a8476d2e6ac"
    },
    {
      "path": "docs/openfoam-v2606-turbulent-model-study-re498104-y50.json",
      "sha256": "a41f41256abd4095bb8b92fa8fac40be760244e3d196f0493e7d043ef619b7c4"
    }
  ]
}
